{"as_of":"2026-10-13T10:00:00+05:00","cohort":"production","dictionaries":{"file_ref":"dictionary.json","sha256":"3cdabe44e4773fa847e13564168e41544f0c4e765e5f2e2ab2316bc26c013ddb"},"index_generation_id":"00000000000000000001","partitions":[{"file_ref":"01-ordinary.json","generation_id":"00000000000000000001","photo_count":1,"received_date":"2026-10-13","sha256":"2e9b7503844bd35c4141a89fc6f0022a04330277bfa6e33d296180272ce9328f"}],"photo_count":1,"published_at":"2026-10-13T10:00:00+05:00","schema_version":"1.0","source_instance_id":"00000000-0000-4000-8000-000000000000-production","source_system":"max_bot_foto","source_timezone":"Asia/Yekaterinburg"}